{
  "format": "meal-planner.backup",
  "schemaVersion": 1,
  "exportedAt": "2026-10-19T18:10:00.000Z",
  "state": {
    "format": "meal-planner.state",
    "schemaVersion": 1,
    "settings": {
      "uiLanguage": "it",
      "reducedMotion": false,
      "weekStartsOn": 1
    },
    "sourcePlans": {
      "source-b4ee68a6-7fed-4a74-a6bc-c9b3b304cc46": {
        "sourceId": "source-b4ee68a6-7fed-4a74-a6bc-c9b3b304cc46",
        "document": {
          "format": "meal-planner.diet",
          "schemaVersion": 1,
          "planId": "phase-3-ui-demo-it",
          "title": "Tre giorni a colori · piano dimostrativo",
          "language": "it",
          "createdAt": "2026-10-19T14:30:00Z",
          "suggestedStartDate": "2026-10-21",
          "baseServings": 1,
          "notes": "Dati fittizi per esplorare l’interfaccia di Project Meal Planner. Il calendario della demo parte dalla data del dispositivo; questo documento conserva le date originali suggerite. Ingredienti e valori sono per una persona. I numeri nutrizionali sono valori illustrativi inventati per mostrare riepiloghi completi e dati mancanti; non costituiscono una valutazione del piano. I testi del piano sono in italiano e rimangono invariati quando si cambia la lingua dell’interfaccia.",
          "preferences": {
            "workSchedule": "Lavoro dalle 09:00 alle 18:00. Colazione alle 07:30, pranzo alle 13:00, spuntino alle 16:30 e cena alle 19:30. Pranzo in ufficio con frigorifero e microonde. Tempo desiderato per la cena: massimo 20 minuti.",
            "leftovers": {
              "allowed": true,
              "notes": "Una preparazione collega la cena del primo giorno al pranzo del giorno successivo. Ogni pasto elenca soltanto gli ingredienti della porzione consumata."
            },
            "ingredientFrequencyLimits": [
              {
                "subject": {
                  "kind": "tag",
                  "id": "contains-cheese",
                  "label": "Pasti con formaggio"
                },
                "maxMeals": 2,
                "period": {
                  "days": 7,
                  "alignment": "rolling"
                }
              },
              {
                "subject": {
                  "kind": "tag",
                  "id": "contains-eggs",
                  "label": "Pasti con uova"
                },
                "maxMeals": 2,
                "period": {
                  "days": 7,
                  "alignment": "rolling"
                }
              }
            ]
          },
          "days": [
            {
              "date": "2026-10-21",
              "meals": [
                {
                  "mealId": "day-01-breakfast",
                  "type": "breakfast",
                  "title": "Yogurt con avena, pera e noci",
                  "time": "07:30",
                  "ingredients": [
                    {
                      "ingredientId": "plain-yogurt",
                      "name": "Yogurt bianco",
                      "quantity": 170,
                      "unit": "g",
                      "category": "dairy",
                      "basis": "as_sold"
                    },
                    {
                      "ingredientId": "rolled-oats",
                      "name": "Fiocchi d'avena",
                      "quantity": 40,
                      "unit": "g",
                      "category": "grains",
                      "basis": "dry"
                    },
                    {
                      "ingredientId": "pear",
                      "name": "Pera",
                      "quantity": 1,
                      "unit": "unit",
                      "category": "produce",
                      "basis": "raw"
                    },
                    {
                      "ingredientId": "walnuts",
                      "name": "Noci sgusciate",
                      "quantity": 15,
                      "unit": "g",
                      "category": "pantry",
                      "basis": "as_sold"
                    }
                  ],
                  "instructions": [
                    "Taglia la pera e spezzetta le noci.",
                    "Aggiungi allo yogurt l'avena, la pera e le noci."
                  ],
                  "prepMinutes": 5,
                  "nutrition": {
                    "kcal": 410,
                    "proteinG": 18,
                    "carbohydratesG": 55,
                    "fatG": 14,
                    "fiberG": 9,
                    "note": "Numeri fittizi usati per dimostrare l’interfaccia. Un valore null indica un dato non disponibile."
                  }
                },
                {
                  "mealId": "day-01-lunch",
                  "type": "lunch",
                  "title": "Insalata di farro, pomodorini e cannellini",
                  "time": "13:00",
                  "ingredients": [
                    {
                      "ingredientId": "spelt",
                      "name": "Farro già cotto",
                      "quantity": 150,
                      "unit": "g",
                      "category": "grains",
                      "basis": "cooked"
                    },
                    {
                      "ingredientId": "canned-cannellini-beans",
                      "name": "Cannellini in scatola",
                      "quantity": 130,
                      "unit": "g",
                      "category": "protein",
                      "basis": "drained"
                    },
                    {
                      "ingredientId": "cherry-tomatoes",
                      "name": "Pomodorini",
                      "quantity": 150,
                      "unit": "g",
                      "category": "produce",
                      "basis": "raw"
                    },
                    {
                      "ingredientId": "olive-oil",
                      "name": "Olio d'oliva",
                      "quantity": 8,
                      "unit": "g",
                      "category": "pantry",
                      "basis": "as_sold"
                    },
                    {
                      "ingredientId": "basil",
                      "name": "Basilico",
                      "quantity": 3,
                      "unit": "g",
                      "category": "produce",
                      "basis": "raw"
                    },
                    {
                      "ingredientId": "salt",
                      "name": "Sale",
                      "quantity": 1,
                      "unit": "g",
                      "category": "pantry",
                      "basis": "as_sold"
                    }
                  ],
                  "instructions": [
                    "Usa il farro già cotto e i cannellini sgocciolati.",
                    "Taglia i pomodorini, unisci tutti gli ingredienti e sistema la porzione nel contenitore per il pranzo."
                  ],
                  "prepMinutes": 12,
                  "tags": [
                    "legumes"
                  ],
                  "notes": "Il tempo indicato presuppone farro già cotto; la quantità non è un peso a secco.",
                  "nutrition": {
                    "kcal": 520,
                    "proteinG": 22,
                    "carbohydratesG": 74,
                    "fatG": 15,
                    "fiberG": 13,
                    "note": "Numeri fittizi usati per dimostrare l’interfaccia. Un valore null indica un dato non disponibile."
                  }
                },
                {
                  "mealId": "day-01-snack",
                  "type": "snack",
                  "title": "Mela e mandorle",
                  "time": "16:30",
                  "ingredients": [
                    {
                      "ingredientId": "apple",
                      "name": "Mela",
                      "quantity": 1,
                      "unit": "unit",
                      "category": "produce",
                      "basis": "raw"
                    },
                    {
                      "ingredientId": "almonds",
                      "name": "Mandorle",
                      "quantity": 20,
                      "unit": "g",
                      "category": "pantry",
                      "basis": "as_sold"
                    }
                  ],
                  "instructions": [
                    "Prepara la mela e la porzione di mandorle per lo spuntino."
                  ],
                  "prepMinutes": 2,
                  "nutrition": {
                    "kcal": 195,
                    "proteinG": 5,
                    "carbohydratesG": 24,
                    "fatG": 10,
                    "fiberG": 6,
                    "note": "Numeri fittizi usati per dimostrare l’interfaccia. Un valore null indica un dato non disponibile."
                  }
                },
                {
                  "mealId": "day-01-dinner",
                  "type": "dinner",
                  "title": "Couscous con ceci e zucchine",
                  "time": "19:30",
                  "ingredients": [
                    {
                      "ingredientId": "instant-couscous",
                      "name": "Couscous istantaneo",
                      "quantity": 70,
                      "unit": "g",
                      "category": "grains",
                      "basis": "dry"
                    },
                    {
                      "ingredientId": "canned-chickpeas",
                      "name": "Ceci in scatola",
                      "quantity": 130,
                      "unit": "g",
                      "category": "protein",
                      "basis": "drained"
                    },
                    {
                      "ingredientId": "zucchini",
                      "name": "Zucchine",
                      "quantity": 250,